<?xml version="1.0" encoding="UTF-8"?>
<bankAccounts xmlns:xsi="http://www.w3.org/2001/XMLSchema-instance" xsi:noNamespaceSchemaLocation="bankAccounts.xsd">
  <account>
    <accountNumber>123456789</accountNumber>
    <accountHolder>John Doe</accountHolder>
    <balance>1500.75</balance>
    <type>Savings</type>
  </account>
  <account>
    <accountNumber>987654321</accountNumber>
    <balance>2500.50</balance>
    <accountHolder>Jane Smith</accountHolder>
    <type>Credit</type>
  </account>
</bankAccounts>
